15:43:35.225692 IP 127.0.0.1.33758 > 127.0.0.1.8080: Flags [S], seq 494363046, win 65495, options [mss 65495,sackOK,TS val 2018128986 ecr 0,nop,wscale 7], length 0
15:43:35.225709 IP 127.0.0.1.8080 > 127.0.0.1.33758: Flags [S.], seq 3613959033, ack 494363047, win 65483, options [mss 65495,sackOK,TS val 2018128986 ecr 2018128986,nop,wscale 7], length 0
15:43:35.225723 IP 127.0.0.1.33758 > 127.0.0.1.8080: Flags [.], ack 3613959034, win 512, options [nop,nop,TS val 2018128986 ecr 2018128986], length 0
15:43:35.227648 IP 127.0.0.1.8080 > 127.0.0.1.33758: Flags [.], seq 3613959034:3613991802, ack 494363047, win 512, options [nop,nop,TS val 2018128988 ecr 2018128986], length 32768: HTTP
15:43:35.227673 IP 127.0.0.1.33758 > 127.0.0.1.8080: Flags [.], ack 3613991802, win 379, options [nop,nop,TS val 2018128988 ecr 2018128988], length 0
15:43:35.227688 IP 127.0.0.1.8080 > 127.0.0.1.33758: Flags [P.], seq 3613991802:3614024570, ack 494363047, win 512, options [nop,nop,TS val 2018128988 ecr 2018128986], length 32768: HTTP
15:43:35.227711 IP 127.0.0.1.33758 > 127.0.0.1.8080: Flags [.], ack 3614024570, win 512, options [nop,nop,TS val 2018128988 ecr 2018128988], length 0
15:43:35.227787 IP 127.0.0.1.8080 > 127.0.0.1.33758: Flags [.], seq 3614024570:3614057338, ack 494363047, win 512, options [nop,nop,TS val 2018128988 ecr 2018128988], length 32768: HTTP
15:43:35.227866 IP 127.0.0.1.8080 > 127.0.0.1.33758: Flags [P.], seq 3614057338:3614090106, ack 494363047, win 512, options [nop,nop,TS val 2018128988 ecr 2018128988], length 32768: HTTP
15:43:35.227871 IP 127.0.0.1.33758 > 127.0.0.1.8080: Flags [.], ack 3614057338, win 512, options [nop,nop,TS val 2018128988 ecr 2018128988], length 0
15:43:35.227876 IP 127.0.0.1.33758 > 127.0.0.1.8080: Flags [.], ack 3614090106, win 1535, options [nop,nop,TS val 2018128988 ecr 2018128988], length 0
15:43:35.227979 IP 127.0.0.1.8080 > 127.0.0.1.33758: Flags [.], seq 3614090106:3614122874, ack 494363047, win 512, options [nop,nop,TS val 2018128988 ecr 2018128988], length 32768: HTTP
15:43:35.228003 IP 127.0.0.1.33758 > 127.0.0.1.8080: Flags [.], ack 3614122874, win 2559, options [nop,nop,TS val 2018128988 ecr 2018128988], length 0
15:43:35.228014 IP 127.0.0.1.8080 > 127.0.0.1.33758: Flags [P.], seq 3614122874:3614155642, ack 494363047, win 512, options [nop,nop,TS val 2018128988 ecr 2018128988], length 32768: HTTP
15:43:35.228019 IP 127.0.0.1.33758 > 127.0.0.1.8080: Flags [.], ack 3614155642, win 3582, options [nop,nop,TS val 2018128988 ecr 2018128988], length 0
15:43:35.228029 IP 127.0.0.1.8080 > 127.0.0.1.33758: Flags [.], seq 3614155642:3614188410, ack 494363047, win 512, options [nop,nop,TS val 2018128988 ecr 2018128988], length 32768: HTTP
15:43:35.228032 IP 127.0.0.1.33758 > 127.0.0.1.8080: Flags [.], ack 3614188410, win 4605, options [nop,nop,TS val 2018128988 ecr 2018128988], length 0
15:43:35.228041 IP 127.0.0.1.8080 > 127.0.0.1.33758: Flags [P.], seq 3614188410:3614221178, ack 494363047, win 512, options [nop,nop,TS val 2018128988 ecr 2018128988], length 32768: HTTP
15:43:35.228044 IP 127.0.0.1.33758 > 127.0.0.1.8080: Flags [.], ack 3614221178, win 5628, options [nop,nop,TS val 2018128989 ecr 2018128988], length 0
15:43:35.228057 IP 127.0.0.1.8080 > 127.0.0.1.33758: Flags [.], seq 3614221178:3614253946, ack 494363047, win 512, options [nop,nop,TS val 2018128988 ecr 2018128988], length 32768: HTTP
15:43:35.228060 IP 127.0.0.1.33758 > 127.0.0.1.8080: Flags [.], ack 3614253946, win 6651, options [nop,nop,TS val 2018128989 ecr 2018128988], length 0
15:43:35.228073 IP 127.0.0.1.8080 > 127.0.0.1.33758: Flags [P.], seq 3614253946:3614286714, ack 494363047, win 512, options [nop,nop,TS val 2018128989 ecr 2018128988], length 32768: HTTP
15:43:35.228076 IP 127.0.0.1.33758 > 127.0.0.1.8080: Flags [.], ack 3614286714, win 7674, options [nop,nop,TS val 2018128989 ecr 2018128989], length 0
15:43:35.228086 IP 127.0.0.1.8080 > 127.0.0.1.33758: Flags [.], seq 3614286714:3614319482, ack 494363047, win 512, options [nop,nop,TS val 2018128989 ecr 2018128988], length 32768: HTTP
15:43:35.228089 IP 127.0.0.1.33758 > 127.0.0.1.8080: Flags [.], ack 3614319482, win 8698, options [nop,nop,TS val 2018128989 ecr 2018128989], length 0
15:43:35.228101 IP 127.0.0.1.8080 > 127.0.0.1.33758: Flags [P.], seq 3614319482:3614352250, ack 494363047, win 512, options [nop,nop,TS val 2018128989 ecr 2018128988], length 32768: HTTP
15:43:35.228103 IP 127.0.0.1.33758 > 127.0.0.1.8080: Flags [.], ack 3614352250, win 9721, options [nop,nop,TS val 2018128989 ecr 2018128989], length 0
15:43:35.228112 IP 127.0.0.1.8080 > 127.0.0.1.33758: Flags [.], seq 3614352250:3614385018, ack 494363047, win 512, options [nop,nop,TS val 2018128989 ecr 2018128988], length 32768: HTTP
15:43:35.228115 IP 127.0.0.1.33758 > 127.0.0.1.8080: Flags [.], ack 3614385018, win 10744, options [nop,nop,TS val 2018128989 ecr 2018128989], length 0
15:43:35.228125 IP 127.0.0.1.8080 > 127.0.0.1.33758: Flags [P.], seq 3614385018:3614417786, ack 494363047, win 512, options [nop,nop,TS val 2018128989 ecr 2018128988], length 32768: HTTP
15:43:35.228127 IP 127.0.0.1.33758 > 127.0.0.1.8080: Flags [.], ack 3614417786, win 11767, options [nop,nop,TS val 2018128989 ecr 2018128989], length 0
15:43:35.228136 IP 127.0.0.1.8080 > 127.0.0.1.33758: Flags [.], seq 3614417786:3614450554, ack 494363047, win 512, options [nop,nop,TS val 2018128989 ecr 2018128988], length 32768: HTTP
15:43:35.228139 IP 127.0.0.1.33758 > 127.0.0.1.8080: Flags [.], ack 3614450554, win 12790, options [nop,nop,TS val 2018128989 ecr 2018128989], length 0
15:43:35.228148 IP 127.0.0.1.8080 > 127.0.0.1.33758: Flags [P.], seq 3614450554:3614483322, ack 494363047, win 512, options [nop,nop,TS val 2018128989 ecr 2018128988], length 32768: HTTP
15:43:35.228150 IP 127.0.0.1.33758 > 127.0.0.1.8080: Flags [.], ack 3614483322, win 13813, options [nop,nop,TS val 2018128989 ecr 2018128989], length 0
15:43:35.228160 IP 127.0.0.1.8080 > 127.0.0.1.33758: Flags [.], seq 3614483322:3614516090, ack 494363047, win 512, options [nop,nop,TS val 2018128989 ecr 2018128988], length 32768: HTTP
15:43:35.228163 IP 127.0.0.1.33758 > 127.0.0.1.8080: Flags [.], ack 3614516090, win 14837, options [nop,nop,TS val 2018128989 ecr 2018128989], length 0
15:43:35.228175 IP 127.0.0.1.8080 > 127.0.0.1.33758: Flags [P.], seq 3614516090:3614548858, ack 494363047, win 512, options [nop,nop,TS val 2018128989 ecr 2018128989], length 32768: HTTP
15:43:35.228178 IP 127.0.0.1.33758 > 127.0.0.1.8080: Flags [.], ack 3614548858, win 15860, options [nop,nop,TS val 2018128989 ecr 2018128989], length 0
15:43:35.228187 IP 127.0.0.1.8080 > 127.0.0.1.33758: Flags [.], seq 3614548858:3614581626, ack 494363047, win 512, options [nop,nop,TS val 2018128989 ecr 2018128989], length 32768: HTTP
15:43:35.228189 IP 127.0.0.1.33758 > 127.0.0.1.8080: Flags [.], ack 3614581626, win 16883, options [nop,nop,TS val 2018128989 ecr 2018128989], length 0
15:43:35.228199 IP 127.0.0.1.8080 > 127.0.0.1.33758: Flags [P.], seq 3614581626:3614614394, ack 494363047, win 512, options [nop,nop,TS val 2018128989 ecr 2018128989], length 32768: HTTP
15:43:35.228202 IP 127.0.0.1.33758 > 127.0.0.1.8080: Flags [.], ack 3614614394, win 17321, options [nop,nop,TS val 2018128989 ecr 2018128989], length 0
15:43:35.228212 IP 127.0.0.1.8080 > 127.0.0.1.33758: Flags [.], seq 3614614394:3614647162, ack 494363047, win 512, options [nop,nop,TS val 2018128989 ecr 2018128989], length 32768: HTTP
15:43:35.228226 IP 127.0.0.1.8080 > 127.0.0.1.33758: Flags [P.], seq 3614647162:3614679930, ack 494363047, win 512, options [nop,nop,TS val 2018128989 ecr 2018128989], length 32768: HTTP
15:43:35.228238 IP 127.0.0.1.8080 > 127.0.0.1.33758: Flags [.], seq 3614679930:3614712698, ack 494363047, win 512, options [nop,nop,TS val 2018128989 ecr 2018128989], length 32768: HTTP
15:43:35.228251 IP 127.0.0.1.8080 > 127.0.0.1.33758: Flags [P.], seq 3614712698:3614745466, ack 494363047, win 512, options [nop,nop,TS val 2018128989 ecr 2018128989], length 32768: HTTP
15:43:35.228262 IP 127.0.0.1.8080 > 127.0.0.1.33758: Flags [.], seq 3614745466:3614778234, ack 494363047, win 512, options [nop,nop,TS val 2018128989 ecr 2018128989], length 32768: HTTP
15:43:35.228274 IP 127.0.0.1.8080 > 127.0.0.1.33758: Flags [P.], seq 3614778234:3614811002, ack 494363047, win 512, options [nop,nop,TS val 2018128989 ecr 2018128989], length 32768: HTTP
15:43:35.228284 IP 127.0.0.1.8080 > 127.0.0.1.33758: Flags [.], seq 3614811002:3614843770, ack 494363047, win 512, options [nop,nop,TS val 2018128989 ecr 2018128989], length 32768: HTTP
15:43:35.228299 IP 127.0.0.1.8080 > 127.0.0.1.33758: Flags [P.], seq 3614843770:3614876538, ack 494363047, win 512, options [nop,nop,TS val 2018128989 ecr 2018128989], length 32768: HTTP
15:43:35.228311 IP 127.0.0.1.8080 > 127.0.0.1.33758: Flags [.], seq 3614876538:3614909306, ack 494363047, win 512, options [nop,nop,TS val 2018128989 ecr 2018128989], length 32768: HTTP
15:43:35.228315 IP 127.0.0.1.33758 > 127.0.0.1.8080: Flags [.], ack 3614811002, win 17321, options [nop,nop,TS val 2018128989 ecr 2018128989], length 0
15:43:35.228318 IP 127.0.0.1.8080 > 127.0.0.1.33758: Flags [P.], seq 3614909306:3614942074, ack 494363047, win 512, options [nop,nop,TS val 2018128989 ecr 2018128989], length 32768: HTTP
15:43:35.228325 IP 127.0.0.1.8080 > 127.0.0.1.33758: Flags [.], seq 3614942074:3614974842, ack 494363047, win 512, options [nop,nop,TS val 2018128989 ecr 2018128989], length 32768: HTTP
15:43:35.228517 IP 127.0.0.1.8080 > 127.0.0.1.33758: Flags [FP.], seq 3614974842:3615007610, ack 494363047, win 512, options [nop,nop,TS val 2018128989 ecr 2018128989], length 32768: HTTP
15:43:35.228726 IP 127.0.0.1.33758 > 127.0.0.1.8080: Flags [.], ack 3615007611, win 17321, options [nop,nop,TS val 2018128989 ecr 2018128989], length 0
15:43:35.257673 IP 127.0.0.1.33758 > 127.0.0.1.8080: Flags [F.], seq 494363047, ack 3615007611, win 17321, options [nop,nop,TS val 2018129018 ecr 2018128989], length 0
15:43:35.257698 IP 127.0.0.1.8080 > 127.0.0.1.33758: Flags [.], ack 494363048, win 512, options [nop,nop,TS val 2018129018 ecr 2018129018], length 0
