15:39:48.274401 IP 127.0.0.1.40166 > 127.0.0.1.8080: Flags [S], seq 3258947490, win 65088, options [mss 576,sackOK,TS val 2017902035 ecr 0,nop,wscale 7], length 0
15:39:48.274413 IP 127.0.0.1.8080 > 127.0.0.1.40166: Flags [S.], seq 3549222435, ack 3258947491, win 65483, options [mss 65495,sackOK,TS val 2017902035 ecr 2017902035,nop,wscale 7], length 0
15:39:48.274422 IP 127.0.0.1.40166 > 127.0.0.1.8080: Flags [.], ack 3549222436, win 509, options [nop,nop,TS val 2017902035 ecr 2017902035], length 0
15:39:48.276095 IP 127.0.0.1.8080 > 127.0.0.1.40166: Flags [P.], seq 3549222436:3549225256, ack 3258947491, win 512, options [nop,nop,TS val 2017902037 ecr 2017902035], length 2820: HTTP
15:39:48.276120 IP 127.0.0.1.40166 > 127.0.0.1.8080: Flags [.], ack 3549225256, win 496, options [nop,nop,TS val 2017902037 ecr 2017902037], length 0
15:39:48.276128 IP 127.0.0.1.8080 > 127.0.0.1.40166: Flags [P.], seq 3549225256:3549228076, ack 3258947491, win 512, options [nop,nop,TS val 2017902037 ecr 2017902035], length 2820: HTTP
15:39:48.276130 IP 127.0.0.1.40166 > 127.0.0.1.8080: Flags [.], ack 3549228076, win 480, options [nop,nop,TS val 2017902037 ecr 2017902037], length 0
15:39:48.276141 IP 127.0.0.1.8080 > 127.0.0.1.40166: Flags [P.], seq 3549228076:3549233716, ack 3258947491, win 512, options [nop,nop,TS val 2017902037 ecr 2017902037], length 5640: HTTP
15:39:48.276143 IP 127.0.0.1.40166 > 127.0.0.1.8080: Flags [.], ack 3549233716, win 458, options [nop,nop,TS val 2017902037 ecr 2017902037], length 0
15:39:48.276146 IP 127.0.0.1.8080 > 127.0.0.1.40166: Flags [P.], seq 3549233716:3549239356, ack 3258947491, win 512, options [nop,nop,TS val 2017902037 ecr 2017902037], length 5640: HTTP
15:39:48.276147 IP 127.0.0.1.40166 > 127.0.0.1.8080: Flags [.], ack 3549239356, win 436, options [nop,nop,TS val 2017902037 ecr 2017902037], length 0
15:39:48.276153 IP 127.0.0.1.8080 > 127.0.0.1.40166: Flags [P.], seq 3549239356:3549250636, ack 3258947491, win 512, options [nop,nop,TS val 2017902037 ecr 2017902037], length 11280: HTTP
15:39:48.276154 IP 127.0.0.1.40166 > 127.0.0.1.8080: Flags [.], ack 3549250636, win 463, options [nop,nop,TS val 2017902037 ecr 2017902037], length 0
15:39:48.276158 IP 127.0.0.1.8080 > 127.0.0.1.40166: Flags [P.], seq 3549250636:3549260224, ack 3258947491, win 512, options [nop,nop,TS val 2017902037 ecr 2017902037], length 9588: HTTP
15:39:48.276159 IP 127.0.0.1.40166 > 127.0.0.1.8080: Flags [.], ack 3549260224, win 421, options [nop,nop,TS val 2017902037 ecr 2017902037], length 0
15:39:48.276160 IP 127.0.0.1.8080 > 127.0.0.1.40166: Flags [P.], seq 3549260224:3549261916, ack 3258947491, win 512, options [nop,nop,TS val 2017902037 ecr 2017902037], length 1692: HTTP
15:39:48.276161 IP 127.0.0.1.40166 > 127.0.0.1.8080: Flags [.], ack 3549261916, win 409, options [nop,nop,TS val 2017902037 ecr 2017902037], length 0
15:39:48.276169 IP 127.0.0.1.8080 > 127.0.0.1.40166: Flags [P.], seq 3549261916:3549284476, ack 3258947491, win 512, options [nop,nop,TS val 2017902037 ecr 2017902037], length 22560: HTTP
15:39:48.276170 IP 127.0.0.1.40166 > 127.0.0.1.8080: Flags [.], ack 3549284476, win 321, options [nop,nop,TS val 2017902037 ecr 2017902037], length 0
15:39:48.276173 IP 127.0.0.1.8080 > 127.0.0.1.40166: Flags [P.], seq 3549284476:3549292372, ack 3258947491, win 512, options [nop,nop,TS val 2017902037 ecr 2017902037], length 7896: HTTP
15:39:48.276174 IP 127.0.0.1.40166 > 127.0.0.1.8080: Flags [.], ack 3549292372, win 290, options [nop,nop,TS val 2017902037 ecr 2017902037], length 0
15:39:48.276188 IP 127.0.0.1.8080 > 127.0.0.1.40166: Flags [P.], seq 3549292372:3549324520, ack 3258947491, win 512, options [nop,nop,TS val 2017902037 ecr 2017902037], length 32148: HTTP
15:39:48.276290 IP 127.0.0.1.40166 > 127.0.0.1.8080: Flags [R.], seq 3258947491, ack 3549324520, win 508, options [nop,nop,TS val 2017902037 ecr 2017902037], length 0
