16:09:07.428886 IP 127.0.0.1.35394 > 127.0.0.1.8080: Flags [S], seq 634434182, win 65495, options [mss 65495,sackOK,TS val 2019661189 ecr 0,nop,wscale 7], length 0
16:09:07.428900 IP 127.0.0.1.8080 > 127.0.0.1.35394: Flags [S.], seq 2982226024, ack 634434183, win 65483, options [mss 65495,sackOK,TS val 2019661189 ecr 2019661189,nop,wscale 7], length 0
16:09:07.428911 IP 127.0.0.1.35394 > 127.0.0.1.8080: Flags [.], ack 2982226025, win 512, options [nop,nop,TS val 2019661189 ecr 2019661189], length 0
16:09:07.430925 IP 127.0.0.1.8080 > 127.0.0.1.35394: Flags [.], seq 2982226025:2982258793, ack 634434183, win 512, options [nop,nop,TS val 2019661191 ecr 2019661189], length 32768: HTTP
16:09:07.430960 IP 127.0.0.1.35394 > 127.0.0.1.8080: Flags [.], ack 2982258793, win 379, options [nop,nop,TS val 2019661191 ecr 2019661191], length 0
16:09:07.430974 IP 127.0.0.1.8080 > 127.0.0.1.35394: Flags [P.], seq 2982258793:2982291561, ack 634434183, win 512, options [nop,nop,TS val 2019661191 ecr 2019661189], length 32768: HTTP
16:09:07.431036 IP 127.0.0.1.35394 > 127.0.0.1.8080: Flags [.], ack 2982291561, win 512, options [nop,nop,TS val 2019661191 ecr 2019661191], length 0
16:09:07.431064 IP 127.0.0.1.8080 > 127.0.0.1.35394: Flags [.], seq 2982291561:2982324329, ack 634434183, win 512, options [nop,nop,TS val 2019661192 ecr 2019661191], length 32768: HTTP
16:09:07.431070 IP 127.0.0.1.35394 > 127.0.0.1.8080: Flags [.], ack 2982324329, win 512, options [nop,nop,TS val 2019661192 ecr 2019661192], length 0
16:09:07.431115 IP 127.0.0.1.8080 > 127.0.0.1.35394: Flags [P.], seq 2982324329:2982357097, ack 634434183, win 512, options [nop,nop,TS val 2019661192 ecr 2019661191], length 32768: HTTP
16:09:07.431149 IP 127.0.0.1.8080 > 127.0.0.1.35394: Flags [.], seq 2982357097:2982389865, ack 634434183, win 512, options [nop,nop,TS val 2019661192 ecr 2019661192], length 32768: HTTP
16:09:07.431197 IP 127.0.0.1.35394 > 127.0.0.1.8080: Flags [.], ack 2982389865, win 512, options [nop,nop,TS val 2019661192 ecr 2019661192], length 0
16:09:07.431281 IP 127.0.0.1.8080 > 127.0.0.1.35394: Flags [P.], seq 2982389865:2982422633, ack 634434183, win 512, options [nop,nop,TS val 2019661192 ecr 2019661192], length 32768: HTTP
16:09:07.431306 IP 127.0.0.1.35394 > 127.0.0.1.8080: Flags [.], ack 2982422633, win 1535, options [nop,nop,TS val 2019661192 ecr 2019661192], length 0
16:09:07.431319 IP 127.0.0.1.8080 > 127.0.0.1.35394: Flags [.], seq 2982422633:2982455401, ack 634434183, win 512, options [nop,nop,TS val 2019661192 ecr 2019661192], length 32768: HTTP
16:09:07.431333 IP 127.0.0.1.8080 > 127.0.0.1.35394: Flags [P.], seq 2982455401:2982488169, ack 634434183, win 512, options [nop,nop,TS val 2019661192 ecr 2019661192], length 32768: HTTP
16:09:07.431343 IP 127.0.0.1.8080 > 127.0.0.1.35394: Flags [.], seq 2982488169:2982520937, ack 634434183, win 512, options [nop,nop,TS val 2019661192 ecr 2019661192], length 32768: HTTP
16:09:07.431353 IP 127.0.0.1.8080 > 127.0.0.1.35394: Flags [P.], seq 2982520937:2982553705, ack 634434183, win 512, options [nop,nop,TS val 2019661192 ecr 2019661192], length 32768: HTTP
16:09:07.431351 IP 127.0.0.1.35394 > 127.0.0.1.8080: Flags [.], ack 2982455401, win 2559, options [nop,nop,TS val 2019661192 ecr 2019661192], length 0
16:09:07.431356 IP 127.0.0.1.35394 > 127.0.0.1.8080: Flags [.], ack 2982488169, win 3582, options [nop,nop,TS val 2019661192 ecr 2019661192], length 0
16:09:07.431360 IP 127.0.0.1.35394 > 127.0.0.1.8080: Flags [.], ack 2982520937, win 4605, options [nop,nop,TS val 2019661192 ecr 2019661192], length 0
16:09:07.431366 IP 127.0.0.1.8080 > 127.0.0.1.35394: Flags [.], seq 2982553705:2982586473, ack 634434183, win 512, options [nop,nop,TS val 2019661192 ecr 2019661192], length 32768: HTTP
16:09:07.431364 IP 127.0.0.1.35394 > 127.0.0.1.8080: Flags [.], ack 2982553705, win 5628, options [nop,nop,TS val 2019661192 ecr 2019661192], length 0
16:09:07.431384 IP 127.0.0.1.8080 > 127.0.0.1.35394: Flags [P.], seq 2982586473:2982619241, ack 634434183, win 512, options [nop,nop,TS val 2019661192 ecr 2019661192], length 32768: HTTP
16:09:07.431387 IP 127.0.0.1.35394 > 127.0.0.1.8080: Flags [.], ack 2982586473, win 6651, options [nop,nop,TS val 2019661192 ecr 2019661192], length 0
16:09:07.431391 IP 127.0.0.1.35394 > 127.0.0.1.8080: Flags [.], ack 2982619241, win 7674, options [nop,nop,TS val 2019661192 ecr 2019661192], length 0
16:09:07.431395 IP 127.0.0.1.8080 > 127.0.0.1.35394: Flags [.], seq 2982619241:2982652009, ack 634434183, win 512, options [nop,nop,TS val 2019661192 ecr 2019661192], length 32768: HTTP
16:09:07.431400 IP 127.0.0.1.35394 > 127.0.0.1.8080: Flags [.], ack 2982652009, win 8698, options [nop,nop,TS val 2019661192 ecr 2019661192], length 0
16:09:07.431412 IP 127.0.0.1.8080 > 127.0.0.1.35394: Flags [P.], seq 2982652009:2982684777, ack 634434183, win 512, options [nop,nop,TS val 2019661192 ecr 2019661192], length 32768: HTTP
16:09:07.431415 IP 127.0.0.1.35394 > 127.0.0.1.8080: Flags [.], ack 2982684777, win 9721, options [nop,nop,TS val 2019661192 ecr 2019661192], length 0
16:09:07.431431 IP 127.0.0.1.8080 > 127.0.0.1.35394: Flags [.], seq 2982684777:2982717545, ack 634434183, win 512, options [nop,nop,TS val 2019661192 ecr 2019661192], length 32768: HTTP
16:09:07.431446 IP 127.0.0.1.8080 > 127.0.0.1.35394: Flags [P.], seq 2982717545:2982750313, ack 634434183, win 512, options [nop,nop,TS val 2019661192 ecr 2019661192], length 32768: HTTP
16:09:07.431452 IP 127.0.0.1.35394 > 127.0.0.1.8080: Flags [.], ack 2982717545, win 10744, options [nop,nop,TS val 2019661192 ecr 2019661192], length 0
16:09:07.431457 IP 127.0.0.1.8080 > 127.0.0.1.35394: Flags [.], seq 2982750313:2982783081, ack 634434183, win 512, options [nop,nop,TS val 2019661192 ecr 2019661192], length 32768: HTTP
16:09:07.431455 IP 127.0.0.1.35394 > 127.0.0.1.8080: Flags [.], ack 2982750313, win 11767, options [nop,nop,TS val 2019661192 ecr 2019661192], length 0
16:09:07.431460 IP 127.0.0.1.35394 > 127.0.0.1.8080: Flags [.], ack 2982783081, win 12790, options [nop,nop,TS val 2019661192 ecr 2019661192], length 0
16:09:07.431474 IP 127.0.0.1.8080 > 127.0.0.1.35394: Flags [P.], seq 2982783081:2982815849, ack 634434183, win 512, options [nop,nop,TS val 2019661192 ecr 2019661192], length 32768: HTTP
16:09:07.431477 IP 127.0.0.1.35394 > 127.0.0.1.8080: Flags [.], ack 2982815849, win 13813, options [nop,nop,TS val 2019661192 ecr 2019661192], length 0
16:09:07.431487 IP 127.0.0.1.8080 > 127.0.0.1.35394: Flags [.], seq 2982815849:2982848617, ack 634434183, win 512, options [nop,nop,TS val 2019661192 ecr 2019661192], length 32768: HTTP
16:09:07.431489 IP 127.0.0.1.35394 > 127.0.0.1.8080: Flags [.], ack 2982848617, win 14837, options [nop,nop,TS val 2019661192 ecr 2019661192], length 0
16:09:07.431502 IP 127.0.0.1.8080 > 127.0.0.1.35394: Flags [P.], seq 2982848617:2982881385, ack 634434183, win 512, options [nop,nop,TS val 2019661192 ecr 2019661192], length 32768: HTTP
16:09:07.431505 IP 127.0.0.1.35394 > 127.0.0.1.8080: Flags [.], ack 2982881385, win 15860, options [nop,nop,TS val 2019661192 ecr 2019661192], length 0
16:09:07.431521 IP 127.0.0.1.8080 > 127.0.0.1.35394: Flags [.], seq 2982881385:2982914153, ack 634434183, win 512, options [nop,nop,TS val 2019661192 ecr 2019661192], length 32768: HTTP
16:09:07.431524 IP 127.0.0.1.35394 > 127.0.0.1.8080: Flags [.], ack 2982914153, win 16883, options [nop,nop,TS val 2019661192 ecr 2019661192], length 0
16:09:07.431536 IP 127.0.0.1.8080 > 127.0.0.1.35394: Flags [P.], seq 2982914153:2982946921, ack 634434183, win 512, options [nop,nop,TS val 2019661192 ecr 2019661192], length 32768: HTTP
16:09:07.431539 IP 127.0.0.1.35394 > 127.0.0.1.8080: Flags [.], ack 2982946921, win 17906, options [nop,nop,TS val 2019661192 ecr 2019661192], length 0
16:09:07.431549 IP 127.0.0.1.8080 > 127.0.0.1.35394: Flags [.], seq 2982946921:2982979689, ack 634434183, win 512, options [nop,nop,TS val 2019661192 ecr 2019661192], length 32768: HTTP
16:09:07.431552 IP 127.0.0.1.35394 > 127.0.0.1.8080: Flags [.], ack 2982979689, win 18929, options [nop,nop,TS val 2019661192 ecr 2019661192], length 0
16:09:07.431563 IP 127.0.0.1.8080 > 127.0.0.1.35394: Flags [P.], seq 2982979689:2983012457, ack 634434183, win 512, options [nop,nop,TS val 2019661192 ecr 2019661192], length 32768: HTTP
16:09:07.431566 IP 127.0.0.1.35394 > 127.0.0.1.8080: Flags [.], ack 2983012457, win 19952, options [nop,nop,TS val 2019661192 ecr 2019661192], length 0
16:09:07.431576 IP 127.0.0.1.8080 > 127.0.0.1.35394: Flags [.], seq 2983012457:2983045225, ack 634434183, win 512, options [nop,nop,TS val 2019661192 ecr 2019661192], length 32768: HTTP
16:09:07.431579 IP 127.0.0.1.35394 > 127.0.0.1.8080: Flags [.], ack 2983045225, win 20976, options [nop,nop,TS val 2019661192 ecr 2019661192], length 0
16:09:07.431590 IP 127.0.0.1.8080 > 127.0.0.1.35394: Flags [P.], seq 2983045225:2983077993, ack 634434183, win 512, options [nop,nop,TS val 2019661192 ecr 2019661192], length 32768: HTTP
16:09:07.431592 IP 127.0.0.1.35394 > 127.0.0.1.8080: Flags [.], ack 2983077993, win 21999, options [nop,nop,TS val 2019661192 ecr 2019661192], length 0
16:09:07.431603 IP 127.0.0.1.8080 > 127.0.0.1.35394: Flags [.], seq 2983077993:2983110761, ack 634434183, win 512, options [nop,nop,TS val 2019661192 ecr 2019661192], length 32768: HTTP
16:09:07.431605 IP 127.0.0.1.35394 > 127.0.0.1.8080: Flags [.], ack 2983110761, win 22262, options [nop,nop,TS val 2019661192 ecr 2019661192], length 0
16:09:07.431616 IP 127.0.0.1.8080 > 127.0.0.1.35394: Flags [P.], seq 2983110761:2983143529, ack 634434183, win 512, options [nop,nop,TS val 2019661192 ecr 2019661192], length 32768: HTTP
16:09:07.431625 IP 127.0.0.1.8080 > 127.0.0.1.35394: Flags [.], seq 2983143529:2983176297, ack 634434183, win 512, options [nop,nop,TS val 2019661192 ecr 2019661192], length 32768: HTTP
16:09:07.431634 IP 127.0.0.1.8080 > 127.0.0.1.35394: Flags [P.], seq 2983176297:2983209065, ack 634434183, win 512, options [nop,nop,TS val 2019661192 ecr 2019661192], length 32768: HTTP
16:09:07.431643 IP 127.0.0.1.8080 > 127.0.0.1.35394: Flags [.], seq 2983209065:2983241833, ack 634434183, win 512, options [nop,nop,TS val 2019661192 ecr 2019661192], length 32768: HTTP
16:09:07.431873 IP 127.0.0.1.8080 > 127.0.0.1.35394: Flags [FP.], seq 2983241833:2983274601, ack 634434183, win 512, options [nop,nop,TS val 2019661192 ecr 2019661192], length 32768: HTTP
16:09:07.432201 IP 127.0.0.1.35394 > 127.0.0.1.8080: Flags [.], ack 2983274602, win 21597, options [nop,nop,TS val 2019661193 ecr 2019661192], length 0
16:09:07.434350 IP 127.0.0.1.35394 > 127.0.0.1.8080: Flags [F.], seq 634434183, ack 2983274602, win 22262, options [nop,nop,TS val 2019661195 ecr 2019661192], length 0
16:09:07.434383 IP 127.0.0.1.8080 > 127.0.0.1.35394: Flags [.], ack 634434184, win 512, options [nop,nop,TS val 2019661195 ecr 2019661195], length 0
