14:47:16.644592 IP 127.0.0.1.36662 > 127.0.0.1.8080: Flags [S], seq 3191776696, win 65495, options [mss 65495,sackOK,TS val 2154617648 ecr 0,nop,wscale 7], length 0
14:47:16.644611 IP 127.0.0.1.8080 > 127.0.0.1.36662: Flags [S.], seq 1736612760, ack 3191776697, win 65483, options [mss 65495,sackOK,TS val 2154617648 ecr 2154617648,nop,wscale 7], length 0
14:47:16.644627 IP 127.0.0.1.36662 > 127.0.0.1.8080: Flags [.], ack 1736612761, win 512, options [nop,nop,TS val 2154617648 ecr 2154617648], length 0
14:47:16.646707 IP 127.0.0.1.8080 > 127.0.0.1.36662: Flags [.], seq 1736612761:1736645529, ack 3191776697, win 512, options [nop,nop,TS val 2154617650 ecr 2154617648], length 32768: HTTP
14:47:16.646735 IP 127.0.0.1.36662 > 127.0.0.1.8080: Flags [.], ack 1736645529, win 379, options [nop,nop,TS val 2154617650 ecr 2154617650], length 0
14:47:16.646751 IP 127.0.0.1.8080 > 127.0.0.1.36662: Flags [P.], seq 1736645529:1736678297, ack 3191776697, win 512, options [nop,nop,TS val 2154617650 ecr 2154617648], length 32768: HTTP
14:47:16.646764 IP 127.0.0.1.36662 > 127.0.0.1.8080: Flags [.], ack 1736678297, win 512, options [nop,nop,TS val 2154617650 ecr 2154617650], length 0
14:47:16.646873 IP 127.0.0.1.8080 > 127.0.0.1.36662: Flags [.], seq 1736678297:1736711065, ack 3191776697, win 512, options [nop,nop,TS val 2154617650 ecr 2154617650], length 32768: HTTP
14:47:16.646957 IP 127.0.0.1.8080 > 127.0.0.1.36662: Flags [P.], seq 1736711065:1736743833, ack 3191776697, win 512, options [nop,nop,TS val 2154617650 ecr 2154617650], length 32768: HTTP
14:47:16.646990 IP 127.0.0.1.36662 > 127.0.0.1.8080: Flags [.], ack 1736743833, win 512, options [nop,nop,TS val 2154617650 ecr 2154617650], length 0
14:47:16.647102 IP 127.0.0.1.8080 > 127.0.0.1.36662: Flags [.], seq 1736743833:1736776601, ack 3191776697, win 512, options [nop,nop,TS val 2154617650 ecr 2154617650], length 32768: HTTP
14:47:16.647152 IP 127.0.0.1.36662 > 127.0.0.1.8080: Flags [.], ack 1736776601, win 1535, options [nop,nop,TS val 2154617650 ecr 2154617650], length 0
14:47:16.647164 IP 127.0.0.1.8080 > 127.0.0.1.36662: Flags [P.], seq 1736776601:1736809369, ack 3191776697, win 512, options [nop,nop,TS val 2154617650 ecr 2154617650], length 32768: HTTP
14:47:16.647168 IP 127.0.0.1.36662 > 127.0.0.1.8080: Flags [.], ack 1736809369, win 2559, options [nop,nop,TS val 2154617650 ecr 2154617650], length 0
14:47:16.647187 IP 127.0.0.1.8080 > 127.0.0.1.36662: Flags [.], seq 1736809369:1736842137, ack 3191776697, win 512, options [nop,nop,TS val 2154617650 ecr 2154617650], length 32768: HTTP
14:47:16.647200 IP 127.0.0.1.8080 > 127.0.0.1.36662: Flags [P.], seq 1736842137:1736874905, ack 3191776697, win 512, options [nop,nop,TS val 2154617650 ecr 2154617650], length 32768: HTTP
14:47:16.647200 IP 127.0.0.1.36662 > 127.0.0.1.8080: Flags [.], ack 1736842137, win 3582, options [nop,nop,TS val 2154617651 ecr 2154617650], length 0
14:47:16.647209 IP 127.0.0.1.8080 > 127.0.0.1.36662: Flags [.], seq 1736874905:1736907673, ack 3191776697, win 512, options [nop,nop,TS val 2154617650 ecr 2154617650], length 32768: HTTP
14:47:16.647206 IP 127.0.0.1.36662 > 127.0.0.1.8080: Flags [.], ack 1736874905, win 4605, options [nop,nop,TS val 2154617651 ecr 2154617650], length 0
14:47:16.647220 IP 127.0.0.1.8080 > 127.0.0.1.36662: Flags [P.], seq 1736907673:1736940441, ack 3191776697, win 512, options [nop,nop,TS val 2154617650 ecr 2154617650], length 32768: HTTP
14:47:16.647219 IP 127.0.0.1.36662 > 127.0.0.1.8080: Flags [.], ack 1736907673, win 5628, options [nop,nop,TS val 2154617651 ecr 2154617650], length 0
14:47:16.647223 IP 127.0.0.1.36662 > 127.0.0.1.8080: Flags [.], ack 1736940441, win 6651, options [nop,nop,TS val 2154617651 ecr 2154617650], length 0
14:47:16.647236 IP 127.0.0.1.8080 > 127.0.0.1.36662: Flags [.], seq 1736940441:1736973209, ack 3191776697, win 512, options [nop,nop,TS val 2154617650 ecr 2154617650], length 32768: HTTP
14:47:16.647239 IP 127.0.0.1.36662 > 127.0.0.1.8080: Flags [.], ack 1736973209, win 7674, options [nop,nop,TS val 2154617651 ecr 2154617650], length 0
14:47:16.647253 IP 127.0.0.1.8080 > 127.0.0.1.36662: Flags [P.], seq 1736973209:1737005977, ack 3191776697, win 512, options [nop,nop,TS val 2154617650 ecr 2154617650], length 32768: HTTP
14:47:16.647266 IP 127.0.0.1.8080 > 127.0.0.1.36662: Flags [.], seq 1737005977:1737038745, ack 3191776697, win 512, options [nop,nop,TS val 2154617650 ecr 2154617650], length 32768: HTTP
14:47:16.647279 IP 127.0.0.1.8080 > 127.0.0.1.36662: Flags [P.], seq 1737038745:1737071513, ack 3191776697, win 512, options [nop,nop,TS val 2154617650 ecr 2154617650], length 32768: HTTP
14:47:16.647293 IP 127.0.0.1.8080 > 127.0.0.1.36662: Flags [.], seq 1737071513:1737104281, ack 3191776697, win 512, options [nop,nop,TS val 2154617650 ecr 2154617650], length 32768: HTTP
14:47:16.647336 IP 127.0.0.1.36662 > 127.0.0.1.8080: Flags [.], ack 1737005977, win 8698, options [nop,nop,TS val 2154617651 ecr 2154617650], length 0
14:47:16.647344 IP 127.0.0.1.8080 > 127.0.0.1.36662: Flags [P.], seq 1737104281:1737137049, ack 3191776697, win 512, options [nop,nop,TS val 2154617651 ecr 2154617651], length 32768: HTTP
14:47:16.647342 IP 127.0.0.1.36662 > 127.0.0.1.8080: Flags [.], ack 1737038745, win 9721, options [nop,nop,TS val 2154617651 ecr 2154617650], length 0
14:47:16.647344 IP 127.0.0.1.36662 > 127.0.0.1.8080: Flags [.], ack 1737071513, win 10744, options [nop,nop,TS val 2154617651 ecr 2154617650], length 0
14:47:16.647349 IP 127.0.0.1.36662 > 127.0.0.1.8080: Flags [.], ack 1737104281, win 11767, options [nop,nop,TS val 2154617651 ecr 2154617650], length 0
14:47:16.647352 IP 127.0.0.1.36662 > 127.0.0.1.8080: Flags [.], ack 1737137049, win 12790, options [nop,nop,TS val 2154617651 ecr 2154617651], length 0
14:47:16.647360 IP 127.0.0.1.8080 > 127.0.0.1.36662: Flags [.], seq 1737137049:1737169817, ack 3191776697, win 512, options [nop,nop,TS val 2154617651 ecr 2154617651], length 32768: HTTP
14:47:16.647365 IP 127.0.0.1.36662 > 127.0.0.1.8080: Flags [.], ack 1737169817, win 13813, options [nop,nop,TS val 2154617651 ecr 2154617651], length 0
14:47:16.647376 IP 127.0.0.1.8080 > 127.0.0.1.36662: Flags [P.], seq 1737169817:1737202585, ack 3191776697, win 512, options [nop,nop,TS val 2154617651 ecr 2154617651], length 32768: HTTP
14:47:16.647379 IP 127.0.0.1.36662 > 127.0.0.1.8080: Flags [.], ack 1737202585, win 14837, options [nop,nop,TS val 2154617651 ecr 2154617651], length 0
14:47:16.647389 IP 127.0.0.1.8080 > 127.0.0.1.36662: Flags [.], seq 1737202585:1737235353, ack 3191776697, win 512, options [nop,nop,TS val 2154617651 ecr 2154617651], length 32768: HTTP
14:47:16.647391 IP 127.0.0.1.36662 > 127.0.0.1.8080: Flags [.], ack 1737235353, win 15860, options [nop,nop,TS val 2154617651 ecr 2154617651], length 0
14:47:16.647402 IP 127.0.0.1.8080 > 127.0.0.1.36662: Flags [P.], seq 1737235353:1737268121, ack 3191776697, win 512, options [nop,nop,TS val 2154617651 ecr 2154617651], length 32768: HTTP
14:47:16.647404 IP 127.0.0.1.36662 > 127.0.0.1.8080: Flags [.], ack 1737268121, win 16883, options [nop,nop,TS val 2154617651 ecr 2154617651], length 0
14:47:16.647415 IP 127.0.0.1.8080 > 127.0.0.1.36662: Flags [.], seq 1737268121:1737300889, ack 3191776697, win 512, options [nop,nop,TS val 2154617651 ecr 2154617651], length 32768: HTTP
14:47:16.647417 IP 127.0.0.1.36662 > 127.0.0.1.8080: Flags [.], ack 1737300889, win 17906, options [nop,nop,TS val 2154617651 ecr 2154617651], length 0
14:47:16.647429 IP 127.0.0.1.8080 > 127.0.0.1.36662: Flags [P.], seq 1737300889:1737333657, ack 3191776697, win 512, options [nop,nop,TS val 2154617651 ecr 2154617651], length 32768: HTTP
14:47:16.647431 IP 127.0.0.1.36662 > 127.0.0.1.8080: Flags [.], ack 1737333657, win 18929, options [nop,nop,TS val 2154617651 ecr 2154617651], length 0
14:47:16.647442 IP 127.0.0.1.8080 > 127.0.0.1.36662: Flags [.], seq 1737333657:1737366425, ack 3191776697, win 512, options [nop,nop,TS val 2154617651 ecr 2154617651], length 32768: HTTP
14:47:16.647444 IP 127.0.0.1.36662 > 127.0.0.1.8080: Flags [.], ack 1737366425, win 19952, options [nop,nop,TS val 2154617651 ecr 2154617651], length 0
14:47:16.647456 IP 127.0.0.1.8080 > 127.0.0.1.36662: Flags [P.], seq 1737366425:1737399193, ack 3191776697, win 512, options [nop,nop,TS val 2154617651 ecr 2154617651], length 32768: HTTP
14:47:16.647459 IP 127.0.0.1.36662 > 127.0.0.1.8080: Flags [.], ack 1737399193, win 20976, options [nop,nop,TS val 2154617651 ecr 2154617651], length 0
14:47:16.647471 IP 127.0.0.1.8080 > 127.0.0.1.36662: Flags [.], seq 1737399193:1737431961, ack 3191776697, win 512, options [nop,nop,TS val 2154617651 ecr 2154617651], length 32768: HTTP
14:47:16.647475 IP 127.0.0.1.36662 > 127.0.0.1.8080: Flags [.], ack 1737431961, win 21999, options [nop,nop,TS val 2154617651 ecr 2154617651], length 0
14:47:16.647487 IP 127.0.0.1.8080 > 127.0.0.1.36662: Flags [P.], seq 1737431961:1737464729, ack 3191776697, win 512, options [nop,nop,TS val 2154617651 ecr 2154617651], length 32768: HTTP
14:47:16.647491 IP 127.0.0.1.36662 > 127.0.0.1.8080: Flags [.], ack 1737464729, win 22714, options [nop,nop,TS val 2154617651 ecr 2154617651], length 0
14:47:16.647507 IP 127.0.0.1.8080 > 127.0.0.1.36662: Flags [.], seq 1737464729:1737497497, ack 3191776697, win 512, options [nop,nop,TS val 2154617651 ecr 2154617651], length 32768: HTTP
14:47:16.647520 IP 127.0.0.1.8080 > 127.0.0.1.36662: Flags [P.], seq 1737497497:1737530265, ack 3191776697, win 512, options [nop,nop,TS val 2154617651 ecr 2154617651], length 32768: HTTP
14:47:16.647528 IP 127.0.0.1.8080 > 127.0.0.1.36662: Flags [.], seq 1737530265:1737563033, ack 3191776697, win 512, options [nop,nop,TS val 2154617651 ecr 2154617651], length 32768: HTTP
14:47:16.647536 IP 127.0.0.1.8080 > 127.0.0.1.36662: Flags [P.], seq 1737563033:1737595801, ack 3191776697, win 512, options [nop,nop,TS val 2154617651 ecr 2154617651], length 32768: HTTP
14:47:16.647545 IP 127.0.0.1.8080 > 127.0.0.1.36662: Flags [.], seq 1737595801:1737628569, ack 3191776697, win 512, options [nop,nop,TS val 2154617651 ecr 2154617651], length 32768: HTTP
14:47:16.647801 IP 127.0.0.1.8080 > 127.0.0.1.36662: Flags [FP.], seq 1737628569:1737661337, ack 3191776697, win 512, options [nop,nop,TS val 2154617651 ecr 2154617651], length 32768: HTTP
14:47:16.648770 IP 127.0.0.1.36662 > 127.0.0.1.8080: Flags [.], ack 1737661338, win 22448, options [nop,nop,TS val 2154617652 ecr 2154617651], length 0
14:47:16.652094 IP 127.0.0.1.36662 > 127.0.0.1.8080: Flags [F.], seq 3191776697, ack 1737661338, win 22714, options [nop,nop,TS val 2154617655 ecr 2154617651], length 0
14:47:16.652108 IP 127.0.0.1.8080 > 127.0.0.1.36662: Flags [.], ack 3191776698, win 512, options [nop,nop,TS val 2154617655 ecr 2154617655], length 0
