16:20:58.615853 lo    In  IP (tos 0x0, ttl 64, id 13626, offset 0, flags [DF], proto TCP (6), length 60)
    127.0.0.1.34196 > 127.0.0.1.8080: Flags [S], cksum 0xfe30 (incorrect -> 0x83ad), seq 4115745241, win 65495, options [mss 65495,sackOK,TS val 2020372376 ecr 0,nop,wscale 7], length 0
16:20:58.615870 lo    In  IP (tos 0x0, ttl 64, id 0, offset 0, flags [DF], proto TCP (6), length 60)
    127.0.0.1.8080 > 127.0.0.1.34196: Flags [S.], cksum 0xfe30 (incorrect -> 0xd75f), seq 714185138, ack 4115745242, win 65483, options [mss 65495,sackOK,TS val 2020372376 ecr 2020372376,nop,wscale 7], length 0
16:20:58.615883 lo    In  IP (tos 0x0, ttl 64, id 13627, offset 0, flags [DF], proto TCP (6), length 52)
    127.0.0.1.34196 > 127.0.0.1.8080: Flags [.], cksum 0xfe28 (incorrect -> 0xfe1b), seq 4115745242, ack 714185139, win 512, options [nop,nop,TS val 2020372376 ecr 2020372376], length 0
16:20:58.617880 lo    In  IP (tos 0x0, ttl 64, id 40828, offset 0, flags [DF], proto TCP (6), length 32820)
    127.0.0.1.8080 > 127.0.0.1.34196: Flags [.], cksum 0x7e29 (incorrect -> 0x2dc9), seq 714185139:714217907, ack 4115745242, win 512, options [nop,nop,TS val 2020372378 ecr 2020372376], length 32768: HTTP
16:20:58.617914 lo    In  IP (tos 0x0, ttl 64, id 13628, offset 0, flags [DF], proto TCP (6), length 52)
    127.0.0.1.34196 > 127.0.0.1.8080: Flags [.], cksum 0xfe28 (incorrect -> 0x7e9c), seq 4115745242, ack 714217907, win 379, options [nop,nop,TS val 2020372378 ecr 2020372378], length 0
16:20:58.617928 lo    In  IP (tos 0x0, ttl 64, id 40829, offset 0, flags [DF], proto TCP (6), length 32820)
    127.0.0.1.8080 > 127.0.0.1.34196: Flags [P.], cksum 0x7e29 (incorrect -> 0xadc0), seq 714217907:714250675, ack 4115745242, win 512, options [nop,nop,TS val 2020372378 ecr 2020372376], length 32768: HTTP
16:20:58.617954 lo    In  IP (tos 0x0, ttl 64, id 13629, offset 0, flags [DF], proto TCP (6), length 52)
    127.0.0.1.34196 > 127.0.0.1.8080: Flags [.], cksum 0xfe28 (incorrect -> 0xfe16), seq 4115745242, ack 714250675, win 512, options [nop,nop,TS val 2020372378 ecr 2020372378], length 0
16:20:58.618024 lo    In  IP (tos 0x0, ttl 64, id 40830, offset 0, flags [DF], proto TCP (6), length 32820)
    127.0.0.1.8080 > 127.0.0.1.34196: Flags [.], cksum 0x7e29 (incorrect -> 0x2dc6), seq 714250675:714283443, ack 4115745242, win 512, options [nop,nop,TS val 2020372378 ecr 2020372378], length 32768: HTTP
16:20:58.618072 lo    In  IP (tos 0x0, ttl 64, id 40831, offset 0, flags [DF], proto TCP (6), length 32820)
    127.0.0.1.8080 > 127.0.0.1.34196: Flags [P.], cksum 0x7e29 (incorrect -> 0xadbd), seq 714283443:714316211, ack 4115745242, win 512, options [nop,nop,TS val 2020372378 ecr 2020372378], length 32768: HTTP
16:20:58.618071 lo    In  IP (tos 0x0, ttl 64, id 13630, offset 0, flags [DF], proto TCP (6), length 52)
    127.0.0.1.34196 > 127.0.0.1.8080: Flags [.], cksum 0xfe28 (incorrect -> 0x7e15), seq 4115745242, ack 714283443, win 512, options [nop,nop,TS val 2020372379 ecr 2020372378], length 0
16:20:58.618088 lo    In  IP (tos 0x0, ttl 64, id 40832, offset 0, flags [DF], proto TCP (6), length 32820)
    127.0.0.1.8080 > 127.0.0.1.34196: Flags [.], cksum 0x7e29 (incorrect -> 0x2dc3), seq 714316211:714348979, ack 4115745242, win 512, options [nop,nop,TS val 2020372379 ecr 2020372379], length 32768: HTTP
16:20:58.618102 lo    In  IP (tos 0x0, ttl 64, id 13631, offset 0, flags [DF], proto TCP (6), length 52)
    127.0.0.1.34196 > 127.0.0.1.8080: Flags [.], cksum 0xfe28 (incorrect -> 0xfe14), seq 4115745242, ack 714316211, win 512, options [nop,nop,TS val 2020372379 ecr 2020372378], length 0
16:20:58.618106 lo    In  IP (tos 0x0, ttl 64, id 13632, offset 0, flags [DF], proto TCP (6), length 52)
    127.0.0.1.34196 > 127.0.0.1.8080: Flags [.], cksum 0xfe28 (incorrect -> 0x7a14), seq 4115745242, ack 714348979, win 1535, options [nop,nop,TS val 2020372379 ecr 2020372379], length 0
16:20:58.618195 lo    In  IP (tos 0x0, ttl 64, id 40833, offset 0, flags [DF], proto TCP (6), length 32820)
    127.0.0.1.8080 > 127.0.0.1.34196: Flags [P.], cksum 0x7e29 (incorrect -> 0xadba), seq 714348979:714381747, ack 4115745242, win 512, options [nop,nop,TS val 2020372379 ecr 2020372379], length 32768: HTTP
16:20:58.618221 lo    In  IP (tos 0x0, ttl 64, id 13633, offset 0, flags [DF], proto TCP (6), length 52)
    127.0.0.1.34196 > 127.0.0.1.8080: Flags [.], cksum 0xfe28 (incorrect -> 0xf613), seq 4115745242, ack 714381747, win 2559, options [nop,nop,TS val 2020372379 ecr 2020372379], length 0
16:20:58.618235 lo    In  IP (tos 0x0, ttl 64, id 40834, offset 0, flags [DF], proto TCP (6), length 32820)
    127.0.0.1.8080 > 127.0.0.1.34196: Flags [.], cksum 0x7e29 (incorrect -> 0x2dc2), seq 714381747:714414515, ack 4115745242, win 512, options [nop,nop,TS val 2020372379 ecr 2020372379], length 32768: HTTP
16:20:58.618240 lo    In  IP (tos 0x0, ttl 64, id 13634, offset 0, flags [DF], proto TCP (6), length 52)
    127.0.0.1.34196 > 127.0.0.1.8080: Flags [.], cksum 0xfe28 (incorrect -> 0x7214), seq 4115745242, ack 714414515, win 3582, options [nop,nop,TS val 2020372379 ecr 2020372379], length 0
16:20:58.618253 lo    In  IP (tos 0x0, ttl 64, id 40835, offset 0, flags [DF], proto TCP (6), length 32820)
    127.0.0.1.8080 > 127.0.0.1.34196: Flags [P.], cksum 0x7e29 (incorrect -> 0xadb9), seq 714414515:714447283, ack 4115745242, win 512, options [nop,nop,TS val 2020372379 ecr 2020372379], length 32768: HTTP
16:20:58.618255 lo    In  IP (tos 0x0, ttl 64, id 13635, offset 0, flags [DF], proto TCP (6), length 52)
    127.0.0.1.34196 > 127.0.0.1.8080: Flags [.], cksum 0xfe28 (incorrect -> 0xee14), seq 4115745242, ack 714447283, win 4605, options [nop,nop,TS val 2020372379 ecr 2020372379], length 0
16:20:58.618264 lo    In  IP (tos 0x0, ttl 64, id 40836, offset 0, flags [DF], proto TCP (6), length 32820)
    127.0.0.1.8080 > 127.0.0.1.34196: Flags [.], cksum 0x7e29 (incorrect -> 0x2dc1), seq 714447283:714480051, ack 4115745242, win 512, options [nop,nop,TS val 2020372379 ecr 2020372379], length 32768: HTTP
16:20:58.618266 lo    In  IP (tos 0x0, ttl 64, id 13636, offset 0, flags [DF], proto TCP (6), length 52)
    127.0.0.1.34196 > 127.0.0.1.8080: Flags [.], cksum 0xfe28 (incorrect -> 0x6a15), seq 4115745242, ack 714480051, win 5628, options [nop,nop,TS val 2020372379 ecr 2020372379], length 0
16:20:58.618276 lo    In  IP (tos 0x0, ttl 64, id 40837, offset 0, flags [DF], proto TCP (6), length 32820)
    127.0.0.1.8080 > 127.0.0.1.34196: Flags [P.], cksum 0x7e29 (incorrect -> 0xadb8), seq 714480051:714512819, ack 4115745242, win 512, options [nop,nop,TS val 2020372379 ecr 2020372379], length 32768: HTTP
16:20:58.618279 lo    In  IP (tos 0x0, ttl 64, id 13637, offset 0, flags [DF], proto TCP (6), length 52)
    127.0.0.1.34196 > 127.0.0.1.8080: Flags [.], cksum 0xfe28 (incorrect -> 0xe615), seq 4115745242, ack 714512819, win 6651, options [nop,nop,TS val 2020372379 ecr 2020372379], length 0
16:20:58.618301 lo    In  IP (tos 0x0, ttl 64, id 40838, offset 0, flags [DF], proto TCP (6), length 32820)
    127.0.0.1.8080 > 127.0.0.1.34196: Flags [.], cksum 0x7e29 (incorrect -> 0x2dc0), seq 714512819:714545587, ack 4115745242, win 512, options [nop,nop,TS val 2020372379 ecr 2020372379], length 32768: HTTP
16:20:58.618308 lo    In  IP (tos 0x0, ttl 64, id 13638, offset 0, flags [DF], proto TCP (6), length 52)
    127.0.0.1.34196 > 127.0.0.1.8080: Flags [.], cksum 0xfe28 (incorrect -> 0x6216), seq 4115745242, ack 714545587, win 7674, options [nop,nop,TS val 2020372379 ecr 2020372379], length 0
16:20:58.618324 lo    In  IP (tos 0x0, ttl 64, id 40839, offset 0, flags [DF], proto TCP (6), length 32820)
    127.0.0.1.8080 > 127.0.0.1.34196: Flags [P.], cksum 0x7e29 (incorrect -> 0xadb7), seq 714545587:714578355, ack 4115745242, win 512, options [nop,nop,TS val 2020372379 ecr 2020372379], length 32768: HTTP
16:20:58.618328 lo    In  IP (tos 0x0, ttl 64, id 13639, offset 0, flags [DF], proto TCP (6), length 52)
    127.0.0.1.34196 > 127.0.0.1.8080: Flags [.], cksum 0xfe28 (incorrect -> 0xde15), seq 4115745242, ack 714578355, win 8698, options [nop,nop,TS val 2020372379 ecr 2020372379], length 0
16:20:58.618339 lo    In  IP (tos 0x0, ttl 64, id 40840, offset 0, flags [DF], proto TCP (6), length 32820)
    127.0.0.1.8080 > 127.0.0.1.34196: Flags [.], cksum 0x7e29 (incorrect -> 0x2dbf), seq 714578355:714611123, ack 4115745242, win 512, options [nop,nop,TS val 2020372379 ecr 2020372379], length 32768: HTTP
16:20:58.618342 lo    In  IP (tos 0x0, ttl 64, id 13640, offset 0, flags [DF], proto TCP (6), length 52)
    127.0.0.1.34196 > 127.0.0.1.8080: Flags [.], cksum 0xfe28 (incorrect -> 0x5a16), seq 4115745242, ack 714611123, win 9721, options [nop,nop,TS val 2020372379 ecr 2020372379], length 0
16:20:58.618352 lo    In  IP (tos 0x0, ttl 64, id 40841, offset 0, flags [DF], proto TCP (6), length 32820)
    127.0.0.1.8080 > 127.0.0.1.34196: Flags [P.], cksum 0x7e29 (incorrect -> 0xadb6), seq 714611123:714643891, ack 4115745242, win 512, options [nop,nop,TS val 2020372379 ecr 2020372379], length 32768: HTTP
16:20:58.618355 lo    In  IP (tos 0x0, ttl 64, id 13641, offset 0, flags [DF], proto TCP (6), length 52)
    127.0.0.1.34196 > 127.0.0.1.8080: Flags [.], cksum 0xfe28 (incorrect -> 0xd616), seq 4115745242, ack 714643891, win 10744, options [nop,nop,TS val 2020372379 ecr 2020372379], length 0
16:20:58.618366 lo    In  IP (tos 0x0, ttl 64, id 40842, offset 0, flags [DF], proto TCP (6), length 32820)
    127.0.0.1.8080 > 127.0.0.1.34196: Flags [.], cksum 0x7e29 (incorrect -> 0x2dbe), seq 714643891:714676659, ack 4115745242, win 512, options [nop,nop,TS val 2020372379 ecr 2020372379], length 32768: HTTP
16:20:58.618369 lo    In  IP (tos 0x0, ttl 64, id 13642, offset 0, flags [DF], proto TCP (6), length 52)
    127.0.0.1.34196 > 127.0.0.1.8080: Flags [.], cksum 0xfe28 (incorrect -> 0x5217), seq 4115745242, ack 714676659, win 11767, options [nop,nop,TS val 2020372379 ecr 2020372379], length 0
16:20:58.618379 lo    In  IP (tos 0x0, ttl 64, id 40843, offset 0, flags [DF], proto TCP (6), length 32820)
    127.0.0.1.8080 > 127.0.0.1.34196: Flags [P.], cksum 0x7e29 (incorrect -> 0xadb5), seq 714676659:714709427, ack 4115745242, win 512, options [nop,nop,TS val 2020372379 ecr 2020372379], length 32768: HTTP
16:20:58.618381 lo    In  IP (tos 0x0, ttl 64, id 13643, offset 0, flags [DF], proto TCP (6), length 52)
    127.0.0.1.34196 > 127.0.0.1.8080: Flags [.], cksum 0xfe28 (incorrect -> 0xce17), seq 4115745242, ack 714709427, win 12790, options [nop,nop,TS val 2020372379 ecr 2020372379], length 0
16:20:58.618392 lo    In  IP (tos 0x0, ttl 64, id 40844, offset 0, flags [DF], proto TCP (6), length 32820)
    127.0.0.1.8080 > 127.0.0.1.34196: Flags [.], cksum 0x7e29 (incorrect -> 0x2dbd), seq 714709427:714742195, ack 4115745242, win 512, options [nop,nop,TS val 2020372379 ecr 2020372379], length 32768: HTTP
16:20:58.618395 lo    In  IP (tos 0x0, ttl 64, id 13644, offset 0, flags [DF], proto TCP (6), length 52)
    127.0.0.1.34196 > 127.0.0.1.8080: Flags [.], cksum 0xfe28 (incorrect -> 0x4a18), seq 4115745242, ack 714742195, win 13813, options [nop,nop,TS val 2020372379 ecr 2020372379], length 0
16:20:58.618406 lo    In  IP (tos 0x0, ttl 64, id 40845, offset 0, flags [DF], proto TCP (6), length 32820)
    127.0.0.1.8080 > 127.0.0.1.34196: Flags [P.], cksum 0x7e29 (incorrect -> 0xadb4), seq 714742195:714774963, ack 4115745242, win 512, options [nop,nop,TS val 2020372379 ecr 2020372379], length 32768: HTTP
16:20:58.618409 lo    In  IP (tos 0x0, ttl 64, id 13645, offset 0, flags [DF], proto TCP (6), length 52)
    127.0.0.1.34196 > 127.0.0.1.8080: Flags [.], cksum 0xfe28 (incorrect -> 0xc617), seq 4115745242, ack 714774963, win 14837, options [nop,nop,TS val 2020372379 ecr 2020372379], length 0
16:20:58.618419 lo    In  IP (tos 0x0, ttl 64, id 40846, offset 0, flags [DF], proto TCP (6), length 32820)
    127.0.0.1.8080 > 127.0.0.1.34196: Flags [.], cksum 0x7e29 (incorrect -> 0x2dbc), seq 714774963:714807731, ack 4115745242, win 512, options [nop,nop,TS val 2020372379 ecr 2020372379], length 32768: HTTP
16:20:58.618422 lo    In  IP (tos 0x0, ttl 64, id 13646, offset 0, flags [DF], proto TCP (6), length 52)
    127.0.0.1.34196 > 127.0.0.1.8080: Flags [.], cksum 0xfe28 (incorrect -> 0x4218), seq 4115745242, ack 714807731, win 15860, options [nop,nop,TS val 2020372379 ecr 2020372379], length 0
16:20:58.618433 lo    In  IP (tos 0x0, ttl 64, id 40847, offset 0, flags [DF], proto TCP (6), length 32820)
    127.0.0.1.8080 > 127.0.0.1.34196: Flags [P.], cksum 0x7e29 (incorrect -> 0xadb3), seq 714807731:714840499, ack 4115745242, win 512, options [nop,nop,TS val 2020372379 ecr 2020372379], length 32768: HTTP
16:20:58.618435 lo    In  IP (tos 0x0, ttl 64, id 13647, offset 0, flags [DF], proto TCP (6), length 52)
    127.0.0.1.34196 > 127.0.0.1.8080: Flags [.], cksum 0xfe28 (incorrect -> 0xbe18), seq 4115745242, ack 714840499, win 16883, options [nop,nop,TS val 2020372379 ecr 2020372379], length 0
16:20:58.618450 lo    In  IP (tos 0x0, ttl 64, id 40848, offset 0, flags [DF], proto TCP (6), length 32820)
    127.0.0.1.8080 > 127.0.0.1.34196: Flags [.], cksum 0x7e29 (incorrect -> 0x2dbb), seq 714840499:714873267, ack 4115745242, win 512, options [nop,nop,TS val 2020372379 ecr 2020372379], length 32768: HTTP
16:20:58.618452 lo    In  IP (tos 0x0, ttl 64, id 13648, offset 0, flags [DF], proto TCP (6), length 52)
    127.0.0.1.34196 > 127.0.0.1.8080: Flags [.], cksum 0xfe28 (incorrect -> 0x3b21), seq 4115745242, ack 714873267, win 17642, options [nop,nop,TS val 2020372379 ecr 2020372379], length 0
16:20:58.618462 lo    In  IP (tos 0x0, ttl 64, id 40849, offset 0, flags [DF], proto TCP (6), length 32820)
    127.0.0.1.8080 > 127.0.0.1.34196: Flags [P.], cksum 0x7e29 (incorrect -> 0xadb2), seq 714873267:714906035, ack 4115745242, win 512, options [nop,nop,TS val 2020372379 ecr 2020372379], length 32768: HTTP
16:20:58.618473 lo    In  IP (tos 0x0, ttl 64, id 40850, offset 0, flags [DF], proto TCP (6), length 32820)
    127.0.0.1.8080 > 127.0.0.1.34196: Flags [.], cksum 0x7e29 (incorrect -> 0x2dba), seq 714906035:714938803, ack 4115745242, win 512, options [nop,nop,TS val 2020372379 ecr 2020372379], length 32768: HTTP
16:20:58.618483 lo    In  IP (tos 0x0, ttl 64, id 40851, offset 0, flags [DF], proto TCP (6), length 32820)
    127.0.0.1.8080 > 127.0.0.1.34196: Flags [P.], cksum 0x7e29 (incorrect -> 0xadb1), seq 714938803:714971571, ack 4115745242, win 512, options [nop,nop,TS val 2020372379 ecr 2020372379], length 32768: HTTP
16:20:58.618494 lo    In  IP (tos 0x0, ttl 64, id 40852, offset 0, flags [DF], proto TCP (6), length 32820)
    127.0.0.1.8080 > 127.0.0.1.34196: Flags [.], cksum 0x7e29 (incorrect -> 0x2db9), seq 714971571:715004339, ack 4115745242, win 512, options [nop,nop,TS val 2020372379 ecr 2020372379], length 32768: HTTP
16:20:58.618505 lo    In  IP (tos 0x0, ttl 64, id 40853, offset 0, flags [DF], proto TCP (6), length 32820)
    127.0.0.1.8080 > 127.0.0.1.34196: Flags [P.], cksum 0x7e29 (incorrect -> 0xadb0), seq 715004339:715037107, ack 4115745242, win 512, options [nop,nop,TS val 2020372379 ecr 2020372379], length 32768: HTTP
16:20:58.618516 lo    In  IP (tos 0x0, ttl 64, id 40854, offset 0, flags [DF], proto TCP (6), length 32820)
    127.0.0.1.8080 > 127.0.0.1.34196: Flags [.], cksum 0x7e29 (incorrect -> 0x2db8), seq 715037107:715069875, ack 4115745242, win 512, options [nop,nop,TS val 2020372379 ecr 2020372379], length 32768: HTTP
16:20:58.618527 lo    In  IP (tos 0x0, ttl 64, id 40855, offset 0, flags [DF], proto TCP (6), length 32820)
    127.0.0.1.8080 > 127.0.0.1.34196: Flags [P.], cksum 0x7e29 (incorrect -> 0xadaf), seq 715069875:715102643, ack 4115745242, win 512, options [nop,nop,TS val 2020372379 ecr 2020372379], length 32768: HTTP
16:20:58.618535 lo    In  IP (tos 0x0, ttl 64, id 40856, offset 0, flags [DF], proto TCP (6), length 32820)
    127.0.0.1.8080 > 127.0.0.1.34196: Flags [.], cksum 0x7e29 (incorrect -> 0x2db7), seq 715102643:715135411, ack 4115745242, win 512, options [nop,nop,TS val 2020372379 ecr 2020372379], length 32768: HTTP
16:20:58.618543 lo    In  IP (tos 0x0, ttl 64, id 40857, offset 0, flags [DF], proto TCP (6), length 32820)
    127.0.0.1.8080 > 127.0.0.1.34196: Flags [P.], cksum 0x7e29 (incorrect -> 0xadae), seq 715135411:715168179, ack 4115745242,