16:35:54.431277 lo    In  IP 127.0.0.1.45104 > 127.0.0.1.8080: Flags [S], seq 2051552301, win 65495, options [mss 65495,sackOK,TS val 2021268192 ecr 0,nop,wscale 7], length 0
16:35:54.431299 lo    In  IP 127.0.0.1.8080 > 127.0.0.1.45104: Flags [S.], seq 2768088407, ack 2051552302, win 65483, options [mss 65495,sackOK,TS val 2021268192 ecr 2021268192,nop,wscale 7], length 0
16:35:54.431315 lo    In  IP 127.0.0.1.45104 > 127.0.0.1.8080: Flags [.], ack 2768088408, win 512, options [nop,nop,TS val 2021268192 ecr 2021268192], length 0
16:35:54.433438 lo    In  IP 127.0.0.1.8080 > 127.0.0.1.45104: Flags [.], seq 2768088408:2768121176, ack 2051552302, win 512, options [nop,nop,TS val 2021268194 ecr 2021268192], length 32768: HTTP
16:35:54.433470 lo    In  IP 127.0.0.1.45104 > 127.0.0.1.8080: Flags [.], ack 2768121176, win 379, options [nop,nop,TS val 2021268194 ecr 2021268194], length 0
16:35:54.433490 lo    In  IP 127.0.0.1.8080 > 127.0.0.1.45104: Flags [P.], seq 2768121176:2768153944, ack 2051552302, win 512, options [nop,nop,TS val 2021268194 ecr 2021268192], length 32768: HTTP
16:35:54.433543 lo    In  IP 127.0.0.1.45104 > 127.0.0.1.8080: Flags [.], ack 2768153944, win 512, options [nop,nop,TS val 2021268194 ecr 2021268194], length 0
16:35:54.433616 lo    In  IP 127.0.0.1.8080 > 127.0.0.1.45104: Flags [.], seq 2768153944:2768186712, ack 2051552302, win 512, options [nop,nop,TS val 2021268194 ecr 2021268194], length 32768: HTTP
16:35:54.433707 lo    In  IP 127.0.0.1.8080 > 127.0.0.1.45104: Flags [P.], seq 2768186712:2768219480, ack 2051552302, win 512, options [nop,nop,TS val 2021268194 ecr 2021268194], length 32768: HTTP
16:35:54.433839 lo    In  IP 127.0.0.1.45104 > 127.0.0.1.8080: Flags [.], ack 2768219480, win 512, options [nop,nop,TS val 2021268194 ecr 2021268194], length 0
16:35:54.433863 lo    In  IP 127.0.0.1.8080 > 127.0.0.1.45104: Flags [.], seq 2768219480:2768252248, ack 2051552302, win 512, options [nop,nop,TS val 2021268194 ecr 2021268194], length 32768: HTTP
16:35:54.433868 lo    In  IP 127.0.0.1.8080 > 127.0.0.1.45104: Flags [P.], seq 2768252248:2768285016, ack 2051552302, win 512, options [nop,nop,TS val 2021268194 ecr 2021268194], length 32768: HTTP
16:35:54.433872 lo    In  IP 127.0.0.1.45104 > 127.0.0.1.8080: Flags [.], ack 2768252248, win 1535, options [nop,nop,TS val 2021268194 ecr 2021268194], length 0
16:35:54.433904 lo    In  IP 127.0.0.1.8080 > 127.0.0.1.45104: Flags [.], seq 2768285016:2768317784, ack 2051552302, win 512, options [nop,nop,TS val 2021268194 ecr 2021268194], length 32768: HTTP
16:35:54.433911 lo    In  IP 127.0.0.1.8080 > 127.0.0.1.45104: Flags [P.], seq 2768317784:2768350552, ack 2051552302, win 512, options [nop,nop,TS val 2021268194 ecr 2021268194], length 32768: HTTP
16:35:54.433917 lo    In  IP 127.0.0.1.8080 > 127.0.0.1.45104: Flags [.], seq 2768350552:2768383320, ack 2051552302, win 512, options [nop,nop,TS val 2021268194 ecr 2021268194], length 32768: HTTP
16:35:54.433923 lo    In  IP 127.0.0.1.8080 > 127.0.0.1.45104: Flags [P.], seq 2768383320:2768416088, ack 2051552302, win 512, options [nop,nop,TS val 2021268194 ecr 2021268194], length 32768: HTTP
16:35:54.433927 lo    In  IP 127.0.0.1.45104 > 127.0.0.1.8080: Flags [.], ack 2768285016, win 2559, options [nop,nop,TS val 2021268194 ecr 2021268194], length 0
16:35:54.433966 lo    In  IP 127.0.0.1.8080 > 127.0.0.1.45104: Flags [.], seq 2768416088:2768448856, ack 2051552302, win 512, options [nop,nop,TS val 2021268194 ecr 2021268194], length 32768: HTTP
16:35:54.433973 lo    In  IP 127.0.0.1.8080 > 127.0.0.1.45104: Flags [P.], seq 2768448856:2768481624, ack 2051552302, win 512, options [nop,nop,TS val 2021268194 ecr 2021268194], length 32768: HTTP
16:35:54.433983 lo    In  IP 127.0.0.1.8080 > 127.0.0.1.45104: Flags [.], seq 2768481624:2768514392, ack 2051552302, win 512, options [nop,nop,TS val 2021268194 ecr 2021268194], length 32768: HTTP
16:35:54.433993 lo    In  IP 127.0.0.1.8080 > 127.0.0.1.45104: Flags [P.], seq 2768514392:2768547160, ack 2051552302, win 512, options [nop,nop,TS val 2021268194 ecr 2021268194], length 32768: HTTP
16:35:54.434000 lo    In  IP 127.0.0.1.8080 > 127.0.0.1.45104: Flags [.], seq 2768547160:2768579928, ack 2051552302, win 512, options [nop,nop,TS val 2021268194 ecr 2021268194], length 32768: HTTP
16:35:54.434007 lo    In  IP 127.0.0.1.45104 > 127.0.0.1.8080: Flags [.], ack 2768317784, win 3582, options [nop,nop,TS val 2021268194 ecr 2021268194], length 0
16:35:54.434031 lo    In  IP 127.0.0.1.8080 > 127.0.0.1.45104: Flags [P.], seq 2768579928:2768612696, ack 2051552302, win 512, options [nop,nop,TS val 2021268194 ecr 2021268194], length 32768: HTTP
16:35:54.434037 lo    In  IP 127.0.0.1.8080 > 127.0.0.1.45104: Flags [.], seq 2768612696:2768645464, ack 2051552302, win 512, options [nop,nop,TS val 2021268194 ecr 2021268194], length 32768: HTTP
16:35:54.434042 lo    In  IP 127.0.0.1.8080 > 127.0.0.1.45104: Flags [P.], seq 2768645464:2768678232, ack 2051552302, win 512, options [nop,nop,TS val 2021268194 ecr 2021268194], length 32768: HTTP
16:35:54.434048 lo    In  IP 127.0.0.1.45104 > 127.0.0.1.8080: Flags [.], ack 2768350552, win 4605, options [nop,nop,TS val 2021268195 ecr 2021268194], length 0
16:35:54.434068 lo    In  IP 127.0.0.1.8080 > 127.0.0.1.45104: Flags [.], seq 2768678232:2768711000, ack 2051552302, win 512, options [nop,nop,TS val 2021268195 ecr 2021268195], length 32768: HTTP
16:35:54.434072 lo    In  IP 127.0.0.1.8080 > 127.0.0.1.45104: Flags [P.], seq 2768711000:2768743768, ack 2051552302, win 512, options [nop,nop,TS val 2021268195 ecr 2021268195], length 32768: HTTP
16:35:54.434076 lo    In  IP 127.0.0.1.45104 > 127.0.0.1.8080: Flags [.], ack 2768383320, win 5628, options [nop,nop,TS val 2021268195 ecr 2021268194], length 0
16:35:54.434098 lo    In  IP 127.0.0.1.8080 > 127.0.0.1.45104: Flags [.], seq 2768743768:2768776536, ack 2051552302, win 512, options [nop,nop,TS val 2021268195 ecr 2021268195], length 32768: HTTP
16:35:54.434103 lo    In  IP 127.0.0.1.8080 > 127.0.0.1.45104: Flags [P.], seq 2768776536:2768809304, ack 2051552302, win 512, options [nop,nop,TS val 2021268195 ecr 2021268195], length 32768: HTTP
16:35:54.434107 lo    In  IP 127.0.0.1.45104 > 127.0.0.1.8080: Flags [.], ack 2768416088, win 6046, options [nop,nop,TS val 2021268195 ecr 2021268194], length 0
16:35:54.434129 lo    In  IP 127.0.0.1.8080 > 127.0.0.1.45104: Flags [.], seq 2768809304:2768842072, ack 2051552302, win 512, options [nop,nop,TS val 2021268195 ecr 2021268195], length 32768: HTTP
16:35:54.434136 lo    In  IP 127.0.0.1.8080 > 127.0.0.1.45104: Flags [P.], seq 2768842072:2768874840, ack 2051552302, win 512, options [nop,nop,TS val 2021268195 ecr 2021268195], length 32768: HTTP
16:35:54.434187 lo    In  IP 127.0.0.1.45104 > 127.0.0.1.8080: Flags [.], ack 2768874840, win 6046, options [nop,nop,TS val 2021268195 ecr 2021268194], length 0
16:35:54.434252 lo    In  IP 127.0.0.1.8080 > 127.0.0.1.45104: Flags [.], seq 2768874840:2768907608, ack 2051552302, win 512, options [nop,nop,TS val 2021268195 ecr 2021268195], length 32768: HTTP
16:35:54.434266 lo    In  IP 127.0.0.1.8080 > 127.0.0.1.45104: Flags [P.], seq 2768907608:2768940376, ack 2051552302, win 512, options [nop,nop,TS val 2021268195 ecr 2021268195], length 32768: HTTP
16:35:54.434279 lo    In  IP 127.0.0.1.8080 > 127.0.0.1.45104: Flags [.], seq 2768940376:2768973144, ack 2051552302, win 512, options [nop,nop,TS val 2021268195 ecr 2021268195], length 32768: HTTP
16:35:54.434287 lo    In  IP 127.0.0.1.8080 > 127.0.0.1.45104: Flags [P.], seq 2768973144:2769005912, ack 2051552302, win 512, options [nop,nop,TS val 2021268195 ecr 2021268195], length 32768: HTTP
16:35:54.434292 lo    In  IP 127.0.0.1.8080 > 127.0.0.1.45104: Flags [.], seq 2769005912:2769038680, ack 2051552302, win 512, options [nop,nop,TS val 2021268195 ecr 2021268195], length 32768: HTTP
16:35:54.434297 lo    In  IP 127.0.0.1.8080 > 127.0.0.1.45104: Flags [P.], seq 2769038680:2769071448, ack 2051552302, win 512, options [nop,nop,TS val 2021268195 ecr 2021268195], length 32768: HTTP
16:35:54.434301 lo    In  IP 127.0.0.1.8080 > 127.0.0.1.45104: Flags [.], seq 2769071448:2769104216, ack 2051552302, win 512, options [nop,nop,TS val 2021268195 ecr 2021268195], length 32768: HTTP
16:35:54.434306 lo    In  IP 127.0.0.1.8080 > 127.0.0.1.45104: Flags [FP.], seq 2769104216:2769136984, ack 2051552302, win 512, options [nop,nop,TS val 2021268195 ecr 2021268195], length 32768: HTTP
16:35:54.434311 lo    In  IP 127.0.0.1.45104 > 127.0.0.1.8080: Flags [.], ack 2768907608, win 7069, options [nop,nop,TS val 2021268195 ecr 2021268195], length 0
16:35:54.434315 lo    In  IP 127.0.0.1.45104 > 127.0.0.1.8080: Flags [.], ack 2768940376, win 8092, options [nop,nop,TS val 2021268195 ecr 2021268195], length 0
16:35:54.434320 lo    In  IP 127.0.0.1.45104 > 127.0.0.1.8080: Flags [.], ack 2768973144, win 9115, options [nop,nop,TS val 2021268195 ecr 2021268195], length 0
16:35:54.434324 lo    In  IP 127.0.0.1.45104 > 127.0.0.1.8080: Flags [.], ack 2769005912, win 10138, options [nop,nop,TS val 2021268195 ecr 2021268195], length 0
16:35:54.434328 lo    In  IP 127.0.0.1.45104 > 127.0.0.1.8080: Flags [.], ack 2769038680, win 11162, options [nop,nop,TS val 2021268195 ecr 2021268195], length 0
16:35:54.434332 lo    In  IP 127.0.0.1.45104 > 127.0.0.1.8080: Flags [.], ack 2769071448, win 12185, options [nop,nop,TS val 2021268195 ecr 2021268195], length 0
16:35:54.434336 lo    In  IP 127.0.0.1.45104 > 127.0.0.1.8080: Flags [.], ack 2769104216, win 13208, options [nop,nop,TS val 2021268195 ecr 2021268195], length 0
16:35:54.434342 lo    In  IP 127.0.0.1.45104 > 127.0.0.1.8080: Flags [.], ack 2769136985, win 14231, options [nop,nop,TS val 2021268195 ecr 2021268195], length 0
16:35:54.438843 lo    In  IP 127.0.0.1.45104 > 127.0.0.1.8080: Flags [F.], seq 2051552302, ack 2769136985, win 14231, options [nop,nop,TS val 2021268199 ecr 2021268195], length 0
16:35:54.438859 lo    In  IP 127.0.0.1.8080 > 127.0.0.1.45104: Flags [.], ack 2051552303, win 512, options [nop,nop,TS val 2021268199 ecr 2021268199], length 0
