16:17:55.312724 lo    In  IP (tos 0x0, ttl 64, id 53858, offset 0, flags [DF], proto TCP (6), length 60)
    localhost.50622 > localhost.http-alt: Flags [S], cksum 0xfe30 (incorrect -> 0x1467), seq 1018756504, win 65495, options [mss 65495,sackOK,TS val 2020189073 ecr 0,nop,wscale 7], length 0
16:17:55.312745 lo    In  IP (tos 0x0, ttl 64, id 0, offset 0, flags [DF], proto TCP (6), length 60)
    localhost.http-alt > localhost.50622: Flags [S.], cksum 0xfe30 (incorrect -> 0xd7b2), seq 4173473777, ack 1018756505, win 65483, options [mss 65495,sackOK,TS val 2020189073 ecr 2020189073,nop,wscale 7], length 0
16:17:55.312760 lo    In  IP (tos 0x0, ttl 64, id 53859, offset 0, flags [DF], proto TCP (6), length 52)
    localhost.50622 > localhost.http-alt: Flags [.], cksum 0xfe28 (incorrect -> 0xfe6e), seq 1, ack 1, win 512, options [nop,nop,TS val 2020189073 ecr 2020189073], length 0
16:17:55.314716 lo    In  IP (tos 0x0, ttl 64, id 27724, offset 0, flags [DF], proto TCP (6), length 32820)
    localhost.http-alt > localhost.50622: Flags [.], cksum 0x7e29 (incorrect -> 0x2e1c), seq 1:32769, ack 1, win 512, options [nop,nop,TS val 2020189075 ecr 2020189073], length 32768: HTTP
16:17:55.314746 lo    In  IP (tos 0x0, ttl 64, id 53860, offset 0, flags [DF], proto TCP (6), length 52)
    localhost.50622 > localhost.http-alt: Flags [.], cksum 0xfe28 (incorrect -> 0x7eef), seq 1, ack 32769, win 379, options [nop,nop,TS val 2020189075 ecr 2020189075], length 0
16:17:55.314763 lo    In  IP (tos 0x0, ttl 64, id 27725, offset 0, flags [DF], proto TCP (6), length 32820)
    localhost.http-alt > localhost.50622: Flags [P.], cksum 0x7e29 (incorrect -> 0xae13), seq 32769:65537, ack 1, win 512, options [nop,nop,TS val 2020189075 ecr 2020189073], length 32768: HTTP
16:17:55.314788 lo    In  IP (tos 0x0, ttl 64, id 53861, offset 0, flags [DF], proto TCP (6), length 52)
    localhost.50622 > localhost.http-alt: Flags [.], cksum 0xfe28 (incorrect -> 0xfe69), seq 1, ack 65537, win 512, options [nop,nop,TS val 2020189075 ecr 2020189075], length 0
16:17:55.314880 lo    In  IP (tos 0x0, ttl 64, id 27726, offset 0, flags [DF], proto TCP (6), length 32820)
    localhost.http-alt > localhost.50622: Flags [.], cksum 0x7e29 (incorrect -> 0x2e19), seq 65537:98305, ack 1, win 512, options [nop,nop,TS val 2020189075 ecr 2020189075], length 32768: HTTP
16:17:55.314927 lo    In  IP (tos 0x0, ttl 64, id 27727, offset 0, flags [DF], proto TCP (6), length 32820)
    localhost.http-alt > localhost.50622: Flags [P.], cksum 0x7e29 (incorrect -> 0xae10), seq 98305:131073, ack 1, win 512, options [nop,nop,TS val 2020189075 ecr 2020189075], length 32768: HTTP
16:17:55.314925 lo    In  IP (tos 0x0, ttl 64, id 53862, offset 0, flags [DF], proto TCP (6), length 52)
    localhost.50622 > localhost.http-alt: Flags [.], cksum 0xfe28 (incorrect -> 0x7e69), seq 1, ack 98305, win 512, options [nop,nop,TS val 2020189075 ecr 2020189075], length 0
16:17:55.314935 lo    In  IP (tos 0x0, ttl 64, id 53863, offset 0, flags [DF], proto TCP (6), length 52)
    localhost.50622 > localhost.http-alt: Flags [.], cksum 0xfe28 (incorrect -> 0xfe68), seq 1, ack 131073, win 512, options [nop,nop,TS val 2020189075 ecr 2020189075], length 0
16:17:55.314944 lo    In  IP (tos 0x0, ttl 64, id 27728, offset 0, flags [DF], proto TCP (6), length 32820)
    localhost.http-alt > localhost.50622: Flags [.], cksum 0x7e29 (incorrect -> 0x2e18), seq 131073:163841, ack 1, win 512, options [nop,nop,TS val 2020189075 ecr 2020189075], length 32768: HTTP
16:17:55.314963 lo    In  IP (tos 0x0, ttl 64, id 53864, offset 0, flags [DF], proto TCP (6), length 52)
    localhost.50622 > localhost.http-alt: Flags [.], cksum 0xfe28 (incorrect -> 0x7a69), seq 1, ack 163841, win 1535, options [nop,nop,TS val 2020189075 ecr 2020189075], length 0
16:17:55.314977 lo    In  IP (tos 0x0, ttl 64, id 27729, offset 0, flags [DF], proto TCP (6), length 32820)
    localhost.http-alt > localhost.50622: Flags [P.], cksum 0x7e29 (incorrect -> 0xae0f), seq 163841:196609, ack 1, win 512, options [nop,nop,TS val 2020189075 ecr 2020189075], length 32768: HTTP
16:17:55.314987 lo    In  IP (tos 0x0, ttl 64, id 27730, offset 0, flags [DF], proto TCP (6), length 32820)
    localhost.http-alt > localhost.50622: Flags [.], cksum 0x7e29 (incorrect -> 0x2e17), seq 196609:229377, ack 1, win 512, options [nop,nop,TS val 2020189075 ecr 2020189075], length 32768: HTTP
16:17:55.314984 lo    In  IP (tos 0x0, ttl 64, id 53865, offset 0, flags [DF], proto TCP (6), length 52)
    localhost.50622 > localhost.http-alt: Flags [.], cksum 0xfe28 (incorrect -> 0xf668), seq 1, ack 196609, win 2559, options [nop,nop,TS val 2020189075 ecr 2020189075], length 0
16:17:55.314998 lo    In  IP (tos 0x0, ttl 64, id 27731, offset 0, flags [DF], proto TCP (6), length 32820)
    localhost.http-alt > localhost.50622: Flags [P.], cksum 0x7e29 (incorrect -> 0xae0e), seq 229377:262145, ack 1, win 512, options [nop,nop,TS val 2020189075 ecr 2020189075], length 32768: HTTP
16:17:55.314995 lo    In  IP (tos 0x0, ttl 64, id 53866, offset 0, flags [DF], proto TCP (6), length 52)
    localhost.50622 > localhost.http-alt: Flags [.], cksum 0xfe28 (incorrect -> 0x7269), seq 1, ack 229377, win 3582, options [nop,nop,TS val 2020189075 ecr 2020189075], length 0
16:17:55.315003 lo    In  IP (tos 0x0, ttl 64, id 53867, offset 0, flags [DF], proto TCP (6), length 52)
    localhost.50622 > localhost.http-alt: Flags [.], cksum 0xfe28 (incorrect -> 0xee69), seq 1, ack 262145, win 4605, options [nop,nop,TS val 2020189075 ecr 2020189075], length 0
16:17:55.315007 lo    In  IP (tos 0x0, ttl 64, id 27732, offset 0, flags [DF], proto TCP (6), length 32820)
    localhost.http-alt > localhost.50622: Flags [.], cksum 0x7e29 (incorrect -> 0x2e16), seq 262145:294913, ack 1, win 512, options [nop,nop,TS val 2020189075 ecr 2020189075], length 32768: HTTP
16:17:55.315010 lo    In  IP (tos 0x0, ttl 64, id 53868, offset 0, flags [DF], proto TCP (6), length 52)
    localhost.50622 > localhost.http-alt: Flags [.], cksum 0xfe28 (incorrect -> 0x6a6a), seq 1, ack 294913, win 5628, options [nop,nop,TS val 2020189075 ecr 2020189075], length 0
16:17:55.315017 lo    In  IP (tos 0x0, ttl 64, id 27733, offset 0, flags [DF], proto TCP (6), length 32820)
    localhost.http-alt > localhost.50622: Flags [P.], cksum 0x7e29 (incorrect -> 0xae0d), seq 294913:327681, ack 1, win 512, options [nop,nop,TS val 2020189075 ecr 2020189075], length 32768: HTTP
16:17:55.315020 lo    In  IP (tos 0x0, ttl 64, id 53869, offset 0, flags [DF], proto TCP (6), length 52)
    localhost.50622 > localhost.http-alt: Flags [.], cksum 0xfe28 (incorrect -> 0xe66a), seq 1, ack 327681, win 6651, options [nop,nop,TS val 2020189075 ecr 2020189075], length 0
16:17:55.315035 lo    In  IP (tos 0x0, ttl 64, id 27734, offset 0, flags [DF], proto TCP (6), length 32820)
    localhost.http-alt > localhost.50622: Flags [.], cksum 0x7e29 (incorrect -> 0x2e15), seq 327681:360449, ack 1, win 512, options [nop,nop,TS val 2020189075 ecr 2020189075], length 32768: HTTP
16:17:55.315038 lo    In  IP (tos 0x0, ttl 64, id 53870, offset 0, flags [DF], proto TCP (6), length 52)
    localhost.50622 > localhost.http-alt: Flags [.], cksum 0xfe28 (incorrect -> 0x626a), seq 1, ack 360449, win 7674, options [nop,nop,TS val 2020189076 ecr 2020189075], length 0
16:17:55.315048 lo    In  IP (tos 0x0, ttl 64, id 27735, offset 0, flags [DF], proto TCP (6), length 32820)
    localhost.http-alt > localhost.50622: Flags [P.], cksum 0x7e29 (incorrect -> 0xae0c), seq 360449:393217, ack 1, win 512, options [nop,nop,TS val 2020189075 ecr 2020189075], length 32768: HTTP
16:17:55.315051 lo    In  IP (tos 0x0, ttl 64, id 53871, offset 0, flags [DF], proto TCP (6), length 52)
    localhost.50622 > localhost.http-alt: Flags [.], cksum 0xfe28 (incorrect -> 0xde69), seq 1, ack 393217, win 8698, options [nop,nop,TS val 2020189076 ecr 2020189075], length 0
16:17:55.315062 lo    In  IP (tos 0x0, ttl 64, id 27736, offset 0, flags [DF], proto TCP (6), length 32820)
    localhost.http-alt > localhost.50622: Flags [.], cksum 0x7e29 (incorrect -> 0x2e14), seq 393217:425985, ack 1, win 512, options [nop,nop,TS val 2020189075 ecr 2020189075], length 32768: HTTP
16:17:55.315064 lo    In  IP (tos 0x0, ttl 64, id 53872, offset 0, flags [DF], proto TCP (6), length 52)
    localhost.50622 > localhost.http-alt: Flags [.], cksum 0xfe28 (incorrect -> 0x5a6a), seq 1, ack 425985, win 9721, options [nop,nop,TS val 2020189076 ecr 2020189075], length 0
16:17:55.315075 lo    In  IP (tos 0x0, ttl 64, id 27737, offset 0, flags [DF], proto TCP (6), length 32820)
    localhost.http-alt > localhost.50622: Flags [P.], cksum 0x7e29 (incorrect -> 0xae0b), seq 425985:458753, ack 1, win 512, options [nop,nop,TS val 2020189075 ecr 2020189075], length 32768: HTTP
16:17:55.315077 lo    In  IP (tos 0x0, ttl 64, id 53873, offset 0, flags [DF], proto TCP (6), length 52)
    localhost.50622 > localhost.http-alt: Flags [.], cksum 0xfe28 (incorrect -> 0xd66a), seq 1, ack 458753, win 10744, options [nop,nop,TS val 2020189076 ecr 2020189075], length 0
16:17:55.315088 lo    In  IP (tos 0x0, ttl 64, id 27738, offset 0, flags [DF], proto TCP (6), length 32820)
    localhost.http-alt > localhost.50622: Flags [.], cksum 0x7e29 (incorrect -> 0x2e13), seq 458753:491521, ack 1, win 512, options [nop,nop,TS val 2020189075 ecr 2020189075], length 32768: HTTP
16:17:55.315090 lo    In  IP (tos 0x0, ttl 64, id 53874, offset 0, flags [DF], proto TCP (6), length 52)
    localhost.50622 > localhost.http-alt: Flags [.], cksum 0xfe28 (incorrect -> 0x526b), seq 1, ack 491521, win 11767, options [nop,nop,TS val 2020189076 ecr 2020189075], length 0
16:17:55.315102 lo    In  IP (tos 0x0, ttl 64, id 27739, offset 0, flags [DF], proto TCP (6), length 32820)
    localhost.http-alt > localhost.50622: Flags [P.], cksum 0x7e29 (incorrect -> 0xae08), seq 491521:524289, ack 1, win 512, options [nop,nop,TS val 2020189076 ecr 2020189076], length 32768: HTTP
16:17:55.315105 lo    In  IP (tos 0x0, ttl 64, id 53875, offset 0, flags [DF], proto TCP (6), length 52)
    localhost.50622 > localhost.http-alt: Flags [.], cksum 0xfe28 (incorrect -> 0xce6a), seq 1, ack 524289, win 12790, options [nop,nop,TS val 2020189076 ecr 2020189076], length 0
16:17:55.315136 lo    In  IP (tos 0x0, ttl 64, id 27740, offset 0, flags [DF], proto TCP (6), length 65535)
    localhost.http-alt > localhost.50622: Flags [.], cksum 0xfdf4 (incorrect -> 0xfed5), seq 524289:589772, ack 1, win 512, options [nop,nop,TS val 2020189076 ecr 2020189076], length 65483: HTTP
16:17:55.315140 lo    In  IP (tos 0x0, ttl 64, id 53876, offset 0, flags [DF], proto TCP (6), length 52)
    localhost.50622 > localhost.http-alt: Flags [.], cksum 0xfe28 (incorrect -> 0xca9f), seq 1, ack 589772, win 13813, options [nop,nop,TS val 2020189076 ecr 2020189076], length 0
16:17:55.315186 lo    In  IP (tos 0x0, ttl 64, id 27741, offset 0, flags [DF], proto TCP (6), length 65535)
    localhost.http-alt > localhost.50622: Flags [.], cksum 0xfdf4 (incorrect -> 0xff09), seq 589772:655255, ack 1, win 512, options [nop,nop,TS val 2020189076 ecr 2020189076], length 65483: HTTP
16:17:55.315189 lo    In  IP (tos 0x0, ttl 64, id 53877, offset 0, flags [DF], proto TCP (6), length 52)
    localhost.50622 > localhost.http-alt: Flags [.], cksum 0xfe28 (incorrect -> 0xc6d3), seq 1, ack 655255, win 14837, options [nop,nop,TS val 2020189076 ecr 2020189076], length 0
16:17:55.315217 lo    In  IP (tos 0x0, ttl 64, id 27742, offset 0, flags [DF], proto TCP (6), length 65535)
    localhost.http-alt > localhost.50622: Flags [.], cksum 0xfdf4 (incorrect -> 0xff3d), seq 655255:720738, ack 1, win 512, options [nop,nop,TS val 2020189076 ecr 2020189076], length 65483: HTTP
16:17:55.315221 lo    In  IP (tos 0x0, ttl 64, id 53878, offset 0, flags [DF], proto TCP (6), length 52)
    localhost.50622 > localhost.http-alt: Flags [.], cksum 0xfe28 (incorrect -> 0xc308), seq 1, ack 720738, win 15860, options [nop,nop,TS val 2020189076 ecr 2020189076], length 0
16:17:55.315247 lo    In  IP (tos 0x0, ttl 64, id 27743, offset 0, flags [DF], proto TCP (6), length 65535)
    localhost.http-alt > localhost.50622: Flags [.], cksum 0xfdf4 (incorrect -> 0xff71), seq 720738:786221, ack 1, win 512, options [nop,nop,